MapID	topics
27921	refugees, immigration, ethics, politics
9791	law, health, ethics, humanrights
29827	prison, ethics, death, crimes, justice
17173	environment, earth, ethics, science
7438	taxation, government, morality, ethics
25981	sex, politics, ethics, justice, society
31766	politics, ethics, internet, information, morality, war
14740	animals, animalrights, police, ethics
16244	government, politics, psychology, ethics, trump, usa
9467	ethics, christianity, religion, pope, catholicism
5601	trump, usa, ethics, politics
12620	myth, ethics
21532	entertainment, movies, ethics, comics, humans
963	policy, law, ethics, children, abortion, parenting
16566	race, equality, ethics, society
5734	anonymity, privacy, law, ethics
33205	ethics, nature
23496	animals, law, health, ethics
2854	military, politics, law, ethics, society
21674	sexualassault, morals, ethics, society
985	law, ethics, humans, life, society
21723	aspd, sociopath, law, shane, ethics, mentalhealth, dawson
2995	race, football, politics, ethics, society, usa
14699	food, ethics, humans, culture, society
29707	poverty, ethics, environment, humans, children
30787	justice, money, society
15666	trump, justice, usa, politics
32172	justice, right, morality, emotion
28474	justice, law, violence, police
4611	justice, literature, equality, elections
33105	justice, turkey, history, war
26696	justice, president, usa
17022	politics, humanrights, violence, justice, usa
26442	justice, law, economics, property
28709	justice, humanrights, lgbtq, equality
1474	justice, law, children, society
8319	justice, law, violence, gun
10237	justice, law, violence
28689	justice, law, life, humanrights
15269	justice, law
29836	nationalism, antifa, fascism, racism, justice, nazi
2868	politics, law, trump, justice, pardon, usa
14365	law, art, justice, media, society
11518	trial, justice, money
26866	politics, psychology, equality, feminism, justice, society
21693	justice, religion, police, gouvernement
29349	justice, literature, freespeech, crimes
5850	race, law, humanrights, justice, freespeech
2232	justice, law, society
8961	justice, law, society, politics
13672	courts, government, law, justice, usa
29867	india, vigilante, feminism, justice, gulabi
10196	justice, police, society
30446	justice, police, governance, crimes
1325	justice, law, usa
6067	justice, violence
21039	justice, politics, unitedstates, government
3946	justice, literature, entertainment
16549	justice, law, government
18480	justice, law, society
12134	justice, uk, world
28302	moral, justice, society, politics
13187	humanrights, law, violence, justice, war
13860	government, race, politics, washington, usa
16376	government, environment, cars, society
16648	space, government, military, politics, usa
29567	healthcare, government, 911dispatch
16083	government, politics, economics, society, usa
28136	government, freedom, politics
17753	government, health, privacy
30569	america, government, usa, ice, descrimination, mexico
21363	government, money, immigration, identity
10402	government, elections, usa, politics
14080	government, law, environment, climatechange
23038	government, usa, economics, politics
5515	humanrights, government, war, society
14410	government, policy, equality, economics, society
13057	government, politics, law, drugs, economics
10393	policy, government, environment, health
18035	government, health, politics
10385	government, cars, food, environment, climatechange
7999	government, elections, politics, oprah, society, usa
12133	government, gun, politics, violence, society
2799	government, health, politics
14255	taxation, government, religion, society
12650	government, politics, law, education, society
23927	government, corruption, politics
24623	government, law, society, politics
23850	government, law, usa, politics
6079	government, politics, trump, society, usa
13621	government, education, culture
16420	policy, government, politics
8337	government, politics, science, environment, earth, climatechange
16035	policy, government, usa, politics
17775	government, military, politics, taxation, funding, society, usa
13974	government, usa, cuba, politics
24631	government, elections, politics, law, society, usa
13035	government, sociology, politics
18593	government, law, equality, religion, jobs, society
14060	government, elections, politics
31213	climate, government, climatechange, governmentpower
18597	government, society, politics
15609	government, society, politics
17645	government, politics
14121	government, law, health, world, society
16974	taxation, government, economics
16755	government, usa, economics, politics
15052	un, government, politics, peace, globalization
12676	government, politics, education, student, economics
4051	government, world, politics
15632	school, government, gun, politics, usa
15335	government, obama, politics, president, usa
24615	government, economics, society
15098	government, police, politics, immigration, usa
26876	government, elections, politics, finance, money
12551	government, india, aadhaar, politics
13876	policy, government, eu, us
12278	government, politics, freedom, libertarian, capitalism
23318	school, government, politics, education, children
16070	government, society, politics
13386	government, police, politics, security, usa
12945	government, health, politics
12138	aviation, government, atc, aircraft, safety, privatization
18524	government, elections, children
17250	mail, government, taxes
17627	policy, government, society, politics
31279	government, right, healthcare, health, care
17593	government, gun, science
21362	government, military, education, suicide, medicine
10341	government, law, world, politics
31476	un, government
24455	government, politics, policy, jobs, usa
23728	australia, government, politics
16794	government, india, money, economics, society
2223	government, immigration, australia
19153	government, society, usa
25497	marriage, government, society
1634	government, poverty, politics, equality, money, economics
13208	government, military, politics, world, war, usa
14140	government, education, jobs, future, economics
21230	government, welfare, unemployment
4950	government, society
17495	government, economics, politics
2469	government, elections, politics, history, usa
2813	government, politics, policy, law, taxation, reform, economics, usa
3171	government, money, economics, society
8516	government, law, elections, politics
15438	switzerland, government, economics
9563	government, education, art, economics
7396	government, uk, health
18668	government, politics, us, constitution, usa
15728	military, government, world, society
4711	space, property, law, economics
1314	law, jobs, health, humanrights
16093	law, children, health, women
1413	sex, women, law, equality, feminism
16454	law, poverty, economics, politics
27268	gun, christchurch, law, gunlaw, firearms
26453	uk, law, islam, politics
17783	media, law, society, usa
9716	law, elections, society, politics
31205	humanrights, law, society
10134	politics, law, humanrights, equality, freespeech
7100	drugs, law, health
26950	law, children, parenting
13282	privacy, business, law, governance, internet
4254	law, politics
14055	genealogy, law, dna
16962	courts, law, murder, unitedstates
9060	policy, smoking, law, health
2027	politics, policy, regulation, law, drugs
2856	regulation, airbnb, law, housing, nyc, economics, usa
30007	jurisprudence, law
17733	internet, law, relationships, society
2871	politics, policy, law, minors, immigration, children, usa
18131	freespeech, law, religion, politics
13864	law, society
12228	law, drugs, marijuana, medicine, usa
16153	politics, law, humanrights, immigration, trump
3991	law, entertainment, sports
6980	world, law, politics
11720	gun, politics, law, constitution, society, usa
12952	law, blockchain, cryptocurrency, crypto, economics, society
16826	law, literature, society
23808	belief, law, violence, religion, culture
14793	law, animalrights, politics
7185	trade, law, housing, broker, house, legislation, commerce, property, realestate, economics, society
10293	military, politics, law, religion, health, marijuana, war, vaccines
16524	psychology, law, sexuality, orientation, children
16592	law, health, economics, medicine
10120	violence, law, gaming, politics
4201	law, usa, constitution, politics
29895	unitedstates, law, murder, mentalhealth, suicide, crimes
7299	drugs, law, marijuana, cannabis
30161	law, community, society, politics
25033	demokratie, wahlrecht, law, politik, steuer
26246	copyright, law, eu, legislation
9351	cars, law, environment, climatechange
31514	law, education, society, future, books
14511	law, usa, constitution, politics
10214	school, politics, law, education, society, usa
15489	law, environment, climatechange, australia
19653	authors, law, copyright, music, creativity
11780	race, police, policebrutality, law, usa
7587	law, environment, climatechange, earth
10317	law, police, society
18938	politics, law, home, civics, rentals, rural
13173	animals, law, society
10049	race, police, law, society, usa
17841	body, law, society
7944	food, law, science, health, safety, bacteria, microbiology, medicine
9647	school, policy, law, education, usa
24279	money, politics, law, humanrights, freespeech
2795	law, usa, science, politics
27376	copyright, law, art, authors
23796	law, cycling, health, safety, society
32830	alcohol, law, drugs, germany, beer, marijuana
10179	drugs, hemp, law, economics
5637	women, law, religion, health, feminism, abortion
15306	law, economics, pollution
4119	law, usa, identity, politics
22325	law, health, medicine
18227	law, usa, economics, politics
7043	school, education, children, liberty
15313	school, education, children, usa
10068	school, education, children
29964	diversity, education, children, english
23120	internet, children, socialmedia, privacy
17722	school, policy, education, children, society
23597	school, education, art, culture, children, society
11504	parenting, uk, children, usa
5409	parenting, children, morality
11798	education, uk, finance, children, economics
16292	teaching, education, children, society
16522	poverty, christianity, religion, children, abortion
7614	school, education, children, parenting
7871	school, education, children, learning
9762	school, gun, politics, violence, children
18740	humanrights, christianity, religion, children, parenting
13236	poverty, economics, environment, humans, climatechange, children
17045	school, education, children, usa
32097	humanrights, parenthood, children, abortion, disability
26258	media, children, entertainment, morality
24773	santa, children, christmas
23139	education, children, vegetarian, vegan
29993	parents, children, family
22714	school, sex, politics, education, children, society
30048	illness, mentalhealth, health, children, nature, nurture
22512	school, police, education, violence, children
16694	videogames, starcitizen, entertainment
2415	harrypotter, literature, entertainment, fandom
18615	sports, entertainment
7704	entertainment, games
29979	entertainment, movies, hollywood, acting, performance, fandom
28772	movies, comics, entertainment, fandom
9760	movies, entertainment, equality, usa
28434	entertainment, movies, marvel, fandom, superheroes
8610	entertainment, startrek, trek, tv, discovery, orville
15876	movies, entertainment, equality, lgbtq
10143	sports, entertainment, football, usa, american_football
1222	sports, entertainment, history
29271	entertainment, marvel, comics, scifi, fandom, superheroes
7055	movies, starwars, entertainment
15596	entertainment, games
14232	space, entertainment, science
29348	videogames, roleplay, entertainment, games
13061	india, entertainment, relationships, bollywood, violence
1221	entertainment, games
28426	internet, entertainment, sport, games
29141	streaming, film, entertainment
2588	sports, entertainment, football, media
14860	sports, basketball, entertainment, nba
2331	got, entertainment
24449	entertainment, relationship, marriage, fandom
21211	music, entertainment, culture
1257	movies, best, entertainment, scifi
9394	entertainment, startrek, sciencefiction, scifi, starwars
13387	entertainment, movies, comics, culture, fandom
10145	bbc, entertainment, science, fandom
27596	art, entertainment, games
10076	entertainment, marvel, comics, culture, fandom
16846	acting, entertainment, transgender, lgbtq
15349	literature, entertainment, fandom
1203	literature, entertainment, fandom
16242	film, starwars, entertainment, sciencefiction
8857	entertainment, film, tv, superhero, comics, society
1622	fantasy, entertainment, movies, scifi, starwars, spoilers
32314	videogames, entertainment, games
23856	media, sports, entertainment, politics
18062	sports, entertainment, usa
5087	guns, entertainment, society
7325	comedy, freespeech, entertainment, humor
31231	debate, rationality, christianity, religion, atheism, god
15593	christianity, judaism, religion, islam
4628	god, religion, history
32729	india, secularism, politics, religion, constitution
10057	christianity, religion, atheism, theism, god, morality
31776	education, science, evolution, religion, god
30988	calvinism, christianity, religion, salvation, protestantism
14936	religion, history, society
28231	christianity, religion, society, morality
30906	god, religion
29870	christianity, god, religion, faith
14057	psychology, god, religion, faith
24180	christianity, religion, history
29615	geography, politics, israel, palestine, religion
30051	christianity, religion, god, bible, faith
10223	epistemology, science, christianity, religion, faith
27023	christianity, religion, history
32184	religion, faith, science
30035	religion
9827	violence, religion, humans, morality, society
32840	education, religion
14445	christianity, judaism, religion, history
6949	psychology, religion, health
13518	religion
9025	christianity, religion, women
30320	movies, publiceducation, moana, religion, 1stamendment, pantheism
30331	belief, religion, pascal
31753	religion
30994	christianity, religion
30171	marriage, diversity, religion, society
32518	god, religion, catholicism, pope
8040	christianity, god, religion, faith
7776	religion, faith, islam
32817	spirit, christianity, religion, spirituality, demon, angel
31832	religion, behavior, freud
22421	religion, public, secularism, freedom
18187	interpretation, sexuality, religion, homosexuality, god, scripture
30347	usa, trump, religion, politics
17732	psychology, life, science, evolution
9354	science, health, homeopathy, publichealth, medicine
27425	race, medicine, science
9613	science, environment, gmo, health, climatechange
1471	drugs, experiment, health, science
30542	evolution, science
30382	space, aliens, scifi, science
19434	publishing, research, science
9269	novax, science, parents, health, vaccines
30362	soap, health, bacteria, science
19554	conspiracy, aliens, society, science
4415	space, earth, future, science
31662	science
31761	science, pollution
31653	science
10082	literature, feminism, science, fandom
31294	science, socialjustice, environment, problemsolving, climatechange, future
24877	space, economics, science
4540	climate, science, environment, humans, society
16326	sex, lgbtq, science, health, medicine
9326	environment, climatechange, economics, science
31265	brain, mental, mind, science, states
17715	food, health, science, politics
9620	environment, climatechange, health, science
1232	einstein, sex, history, science
8911	space, future, science
11268	space, earth, science
7591	space, science
3615	politics, knowledge, science, power, bias
7487	food, science, environment, climatechange, future
1258	space, aliens, science
23608	education, society, public, science
27658	academia, publishing, science
15955	complexity, computing, theory, science
28756	openscience, science, wikipedia
3185	futurism, climate, science, ecology, earth
14152	science
14194	weather, science, earth, environment, climatechange
21024	publishing, science
21952	history, society, politics
32290	terrorism, usa, politics
9396	military, politics, germany, safety, war
5064	cars, politics, policy, taxation, economics, usa
14346	women, politics, taxation, feminism, society
23340	politics, conservative, parliament, uk, labour
18595	politics, pence, usa, trump, journalism, foreignpolicy
29723	politics, campaigning, dnc, culture, media
9143	politics, environment, health, climatechange, economics, society
28901	policy, political, politics
26125	politics, foreignpolicy, foreignaid, world, usa
18504	politics
31378	republicans, elections, primaries, politics
26556	un, venezuela, military, politics
23114	money, economics, politics
1323	animalrights, culture, politics
18629	corporations, economics, politics
22691	canada, politics
32636	military, china, politics, international, usa
29497	iran, unitedstates, war, politics
18147	marriage, equality, society, politics
17915	un, security, globalization, politics
4272	war, politics
30274	politics, antifa, germany, antifascism, usa
8267	gerrymandering, usa, politics
33211	politics, socialmedia, protection, online, internet, cyberbullying
7584	australia, republic, politics
13854	school, police, gun, politics, violence, society
5581	school, politics, policy, education, uk, health
25803	work, education, economics, politics
24278	pakistan, india, war, politics
14932	oil, pipeline, politics, business, canada
30072	politics, 2020, biden, trump, usa
16174	lgbtq, economics, politics
1324	reparations, race, slavery, politics, usa
17856	elections, usa, politics
8457	politics, humanrights, equality, economics, society
14248	business, seattle, politics
33056	news, socialmedia, politics
23831	uk, parliament, elections, politics
31316	politics, ideology, socialism, capitalism, anarchy, test
10343	trump, world, usa, politics
29509	psychology, sociology, evolution, politics
18967	india, modi, gandhi, politics
3344	world, history, politics
21064	inheritance, equality, economics, politics
13759	military, politics, security, usa, foreignpolicy
9686	campaigning, finance, politics
13322	america, politics, history, capitalism, economics
16915	usa, abortion, politics
4774	economics, society, politics
33292	monarchy, uk, politics
32878	un, unitednations, politics
30339	nations, politics, states, culture, economics
19171	usa, mexico, society, politics
2567	attacks, terror, protest, politics
7533	usa, multiparty, politics
31228	hongkong, china, protest, politics
30731	elections, referendum, brexit, politics, president, trump
2233	media, society, politics
13449	cars, society, politics
1128	refugees, economics, politics
19334	courts, sexualassault, politics
26322	brexit, uk, politics
24657	mexico, politics, trump, economics, usa
17063	sports, economics, politics
29948	republicans, democrats, controversial, politics
10154	politics, education, economics, society, usa
17261	usa, money, economics, politics
2177	nuclearweapons, northkorea, politics
24439	immigration, society, politics
32298	politics
30154	asylum, politics, immigration, refugees, migrants
32101	environment, climatechange, politics
28043	privacy, usa, ecuador, politics
28468	france, history, revolution, politics
444	taxation, economicinequality, economics, politics
9966	economics, society, politics
4624	republicans, democrats, usa, politics
4650	elections, usa, reform, politics
10296	brexit, politics, cta, uk, ireland, northernireland
16931	politics, business, humanrights, equality, economics
5589	elections, usa, politics
14588	cars, safety, politics
9907	economics, war, politics
4458	republicans, politics, trump, democrats, usa
4608	elections, money, equality, politics
9823	nationalism, economics, society, politics
10098	nato, politics, afghanistan, war, usa
2760	employee, unions, economics, politics
8051	tor, politics, security, infosec, internet, darkweb
4237	referendum, brexit, politics, uk, eu, economics
24265	elections, immigration, politics
18293	politics, animals, environment, world, climatechange
21749	usa, immigration, politics
6695	truth, elections, society, politics
10252	business, economics, politics
14345	poverty, equality, society, politics
29982	taiwan, president, politics
14053	politics, equality, ubi, economics, society
8742	taxation, capitalism, economics, politics
16322	politicalcorrectness, norms, politics, civility, trump, decency
30236	china, worldaffairs, politics, taiwan, southchinasea, war
12750	politics, violence, society, humans, war
9004	trump, world, usa, politics
29690	elections, vote, politics
2853	nuclearweapons, usa, northkorea, politics
32820	hackers, politics
17763	politics, feminism, economics, society, parenting
28996	politics, blockchain, cryptocurrency, governance, crypto, ethereum
2091	un, politics, israel, palestine, usa
24923	politics, impeachment, pence, president, trump, political
14478	southasia, india, politics
3346	gun, politics, violence, society, usa
33086	discrimination, college, politics
28162	gameofthrones, tv, politics
2226	elections, reform, society, politics
23902	world, economics, politics
29602	humanities, education, university, politics
12140	ai, society, politics
13225	california, infrastructure, water, politics
1414	privacy, society, politics
9965	patriotism, usa, society, politics
7841	liberty, politics, markets, economics, society
18869	elections, politics, us, vote, society
8674	australia, equality, culture, politics
7840	usa, economics, society, politics
23626	politics, drugs, violence, economics, mexico
31850	brexit, uk, politics
1764	education, freespeech, politics
29906	politics, history, violence, moral, political
25338	taxation, environment, climatechange, politics
7304	politics, humanrights, health, medicine, society
2179	northkorea, usa, politics
18183	politics, policy, unification, ireland, northernireland
33047	elections, voting, politics
29912	taiwan, politics
18355	un, humanrights, war, politics
32876	elections, republicans, politics, trump, democrats, usa
15765	economics, society, politics
29944	politics, taxation, capitalism, georgism, economics, society
7565	taxation, education, college, politics
1260	countries, life, best, politics
29320	uk, elections, politics
24392	uk, britain, parliament, politics
9997	usa, immigration, politics
31372	america, usa, obama, politics
27811	un, world, climatechange, politics
14742	elections, society, politics
30985	environment, politics
12545	school, education
12651	anthropology, education, humanities, culture
19017	school, education
10133	uk, education, society
20776	education
1926	empowerment, literature, race, slavery, education, censorship, usa
4555	education, mastery, feedback, grades, schooling, competency
30188	education, student, wealth, college
11784	psychology, education, violence, gun
7873	education, grades, student
21844	education, economics, usa
31178	kids, education, society, programming
31849	sports, chess, education, creativity, games, learning
12100	school, purpose, education, uk, learning, wellbeing
28851	school, education, learning
32034	education
18510	school, education, health
19289	school, education, society
16422	education, society, media
31946	weather, education, digital, inclement, learning
32301	education, scuola
24256	violence, education, society
6090	women, education, equality, environment, life, economics
30858	school, education
16218	school, violence, education
7600	literature, education, culture, society
14416	education, history, culture, society, usa
4193	school, education, health
9197	education, economics, society
13059	education
4401	school, education, policy, sex
6467	education, literature
8606	school, education, usa
9549	education, literature, india
32846	teaching, education, bildung
32759	mathematics, education
12828	business, education, equality, freedom
9841	anatomy, education, ar, medicine, vr
28342	emotion, future, society
14286	freespeech, society, usa
12577	marriage, relationships, society
9226	earth, environment, humans, climatechange, society
31658	epistemology, equalopportunity, humanrights, equality, morality, society
27337	independence, relationships, individual, culture, society
1528	lifestyle, health, society
33113	society
19174	cars, traffic, mobile, society, mobility
18052	divination, occult, society, tarot
14770	privacy, media, society
14048	society
8021	languages, world, culture, society
10249	ancient, effect, culture, greece, society
21205	health, society
14448	currency, society
12218	violence, society, parenting
11266	debate, anonymity, discourse, freespeech, society
21101	psychology, drugs, society, health, disease
22324	humans, relationships, society
22143	tipping, service, money, economics, society
7121	food, health, humans, medicine, society
16591	environment, earth, humans, life, climatechange, society
32205	christmas, society, easter
8653	marriage, relationships, sex, society
32589	languages, communication, society
19221	business, cars, environment, society
18711	environment, climatechange, future, economics, society
22967	business, economics, society
15238	sports, society, usa
14886	business, jobs, economics, society
11186	kialo, discourse, workculture, society
17670	driving, wellbeing, safety, society
16993	society
25697	music, culture, society
7405	history, time, health, life, society
13564	evolution, humans, ai, society
24634	women, marriage, relationships, culture, society
25000	business, culture, jobs, economics, society
9903	ubi, economics, society
16989	economy, race, equality, society
32171	environment, health, economics, society
25742	lgbtq, society, games
29555	humans, health, society
17881	economics, society
15493	business, economics, entrepreneur
30748	corporations, investing, business, policy, investment, economics
22537	distribution, equality, economics
14283	blockchain, cryptocurrency, icos, investment, crypto, economics
18681	economics
17978	trade, usa, nafta, trump, economics, canada, mexico
27632	cancer, health, economics, medicine
15900	environment, climatechange, economics, earth
2230	economics
16618	economics, usa
29627	sustainability, disposable, toxins, environment, health, economics
